name,ph_seq,ph_dur
4_slsz_15,SP h ai i ou sh ei n eng l ai j i ao uo SP ai SP AP SP,0.297959 0.12 0.5175 0.0125 0.03 0.18 0.22 0.15 0.26 0.11 0.24 0.37 0.01 0.01 0.735 0.095 1.585 0.38 0.435 0.49219
4_trhxn_2,SP z u ei p SP a h u ei SP i SP t u r an f an g u en j i ao t ong zh e SP AP b u SP p ing x i,0.334399 0.18 0.01 0.0375 0.2275 0.085 0.3175 0.1325 0.01 0.19 0.08 0.92 0.05 0.14 0.29 0.08 0.16 0.15 0.48 0.07 0.01 0.3 0.2 0.01 0.1 0.12 0.48 0.11 0.32 0.085 0.365 0.09 0.125 0.125 0.33 0.13 0.18 0.25281
4_jd_18,SP i q i an d e i j v h ua,0.588322 0.3 0.24 0.04 0.34 0.07 0.46 0.32 0.24 0.29 0.19 0.30575
4_trhxn_1,z u ei SP p a SP p eng i ou t u r an d e g uan x in SP,0.14 0.01 0.27 0.11 0.04 0.645 0.105 0.06 0.54 0.01 0.15 0.17 0.31 0.1 0.35 0.08 0.12 0.11 0.51 0.17 0.825 0.544861
4_ckyg_23,SP van l ai t ang z ai n i sh ou sh ang SP AP,0.09 0.3775 0.0725 0.11 0.17 0.34 0.11 0.37 0.1 0.27 0.17 0.15 0.17 1.14 0.175 0.38781
4_wzqad_4,sh i j ie b u g uan z en i ang h u ang l i ang SP AP SP,0.24 0.3075 0.1125 0.3175 0.1325 0.27 0.15 0.26 0.18 0.49 0.01 0.09 0.28 0.01 0.13 0.12 0.01 0.795 0.33 0.225 0.06794
4_hjbj_23,SP uo h u ei d ai zh e x i ao l i an SP h u ei sh ou h an x van SP AP SP,0.08 0.1475 0.36 0.0125 0.02 0.13 0.26 0.13 0.21 0.44 0.01 0.02 0.13 0.01 0.725 0.545 0.24 0.02 0.21 0.18 0.18 0.16 0.24 0.21 1.0 0.09 0.27725 0.421224
4_nn_14,zh en x in d e d u ei uo h ao AP,0.13 0.38 0.16 0.18 0.1 0.18 0.11 0.01 0.22 0.21 0.13 0.265 0.247
4_jd_14,z ai t i an SP h ei l e SP i h ou SP,0.2 0.15 0.14 0.02 0.165 0.045 0.06 0.15 0.11 0.32 0.17 0.28 0.21 0.41812 0.127302
4_hjbj_20,SP uo m en h u ei b u d ao SP AP n a t i an SP AP SP,0.236576 0.3075 0.0925 0.28 0.76 0.01 0.02 0.16 0.28 0.12 0.58 0.105 0.345 0.14 0.3 0.19 0.02 1.66 0.255 0.52475 0.323787
4_hjbj_2,SP x i ang x i ang zh e SP AP m ei uo d e r i z i SP AP,0.174014 0.9875 0.0125 0.02 0.44 0.01 0.06 0.11 0.78 0.305 0.27 0.165 0.38 0.37 0.08 0.22 0.21 0.19 0.17 0.64 0.41 0.32331
4_yhys_9,k e sh i n i z ai q i ao d a AP uo d e ch u ang l ing SP AP,0.16 0.29 0.3675 0.07 0.1525 1.0 0.12 0.29 0.21 0.01 0.67 0.12 0.3 0.4025 0.4075 0.08 0.19 0.21 0.01 0.75 0.07 0.875 0.16 0.35288
4_yhys_8,SP ve er m ing f eng er q ing AP,0.18 0.0875 1.3025 0.21 1.41 0.2 1.11 0.3 0.19 0.31 0.31925
4_slsz_32,SP uo b u sh i i d ing i ao n i h u ei l ai SP AP,0.07 0.3275 0.0625 0.1575 0.5725 0.01 0.33 0.09 0.65 0.01 0.02 0.1 0.19 0.16 0.01 0.34 0.09 1.085 0.235 0.48231
4_trhxn_15,SP r an SP h ou l i ou x ia SP AP z u ei t ong d e j i n i an SP p in SP AP SP AP,0.492993 0.05 0.31 0.11 0.03 0.3 0.28 0.01 0.02 0.23 0.725 0.125 0.49 0.18 0.01 0.02 0.15 0.36 0.08 0.22 0.17 0.34 0.07 0.02 0.325 0.085 0.03 1.59 0.395 0.225 0.52 0.35512
4_nbzdds_36,SP uo j i an ch i b u n eng sh uo,0.299478 0.275 0.3625 0.0125 0.02 0.18 0.18 0.09 0.22 0.11 0.2 0.18 0.56169
4_yhys_14,SP i d ing sh i n i l ai sh i t ai x i ao x in SP AP SP,0.558776 0.42 0.14 0.48 0.38 0.02 0.18 0.44 0.12 0.44 0.37 0.05 0.17 0.4925 0.4975 0.01 0.02 0.25 0.69 0.3 0.625 0.10088
4_nn_38,SP uo x i ang sh uo q i sh i n i h en h ao SP,0.392698 0.2475 0.24 0.0125 0.07 0.13 0.13 0.19 0.13 0.31 0.02 0.1 0.15 0.14 0.19 0.1 0.51031 0.119728
4_nbzdds_9,SP uo q ve m ei zh uo j in n i SP AP,0.21 0.03 0.21 0.47 0.24 0.2 0.17 0.47 0.24 0.45 0.21 1.63 0.345 0.39594
4_zgz_16,SP i ou d e ai x i ang i ang g u ang q ing l uo SP AP,0.671995 0.01 0.02 0.11 0.53 0.12 0.52 0.02 0.01 0.02 0.17 0.36 0.01 0.02 0.2 0.17 0.24 0.405 0.08 0.23056
4_syst_12,t ou z ou l e q ing s i q ve l i ou zh u i g e n i AP SP,0.15 0.14 0.11 0.18 0.06 0.33 0.2 0.09 0.18 0.08 0.18 0.33 0.15 0.01 0.1 0.1 0.18 0.17 0.17 0.24 0.16 0.34 0.34388 0.41034
4_ycjh_34,z ai m ei i ou f an n ao d e j i ao l uo l i t ing zh i x vn zh ao SP AP SP,0.13 0.19 0.13 0.4575 0.0125 0.0675 0.1525 0.2 0.14 0.23 0.15 0.22 0.14 0.01 0.26 0.1 0.25 0.12 0.18 0.17 0.24 0.1 0.2 0.16 0.26 0.09 0.675 0.14 0.42106 0.187528
4_yhys_19,SP u ang l e h u ei t ou k an AP t a i ou m ei i ou k u AP SP,0.167982 0.01 0.2475 0.0325 0.06 0.2175 0.0125 0.02 0.18 0.21 0.24 0.825 0.3525 0.1325 0.72 0.01 0.02 0.25 0.77 0.01 0.02 0.23 1.045 0.40862 0.261905
4_nn_32,SP n i z i j i q ve b u zh i d ao AP,0.384308 0.06 0.17 0.13 0.1475 0.1225 0.14 0.17 0.17 0.12 0.17 0.11 0.21 0.09 0.61 0.41288
4_ckyg_29,SP k e uo AP b u c eng j i an g uo h ai i ang SP,0.48415 0.12 0.2575 0.2625 0.325 0.075 0.31 0.17 0.33 0.11 0.05 0.35 0.06 0.14 0.13 0.43 0.02 0.38944 0.141655
4_hjbj_12,SP uo d uo m e x i ang h e n i j i an i m i an SP AP SP,0.14 0.12 0.12 0.3 0.11 0.26 0.27 0.01 0.13 0.15 0.23 0.15 0.41 0.18 0.04 0.45 0.36 0.18 0.01 1.425 0.225 0.535 0.124422
4_ycjh_10,SP i c i j i ou h ao SP uo d ai n i q v k an t i an h u ang d i l ao SP AP,0.400794 0.21 0.17 0.1575 0.32 0.0125 0.02 0.17 0.35 0.29 0.21 0.14 0.24 0.11 0.2 0.19 0.18 0.14 0.22 0.15 0.01 0.22 0.34 0.01 0.02 0.09 0.25 0.11 0.665 0.255 0.33112
4_ycjh_0,SP x i ang k an n i x i ao SP,0.065 0.5225 0.0125 0.02 0.21 0.35 0.22 0.18 0.59 0.01 0.09 0.648156
4_htdst_25,l u en u ei x ia SP p i an d e d i an ing SP AP SP,0.15 0.02 0.5175 0.0125 0.04 0.18 0.29 0.11 0.21 0.01 0.02 0.13 1.04 0.15 0.03 0.02 1.03 0.085 0.27394 0.457574
4_zgz_38,SP uo k e i d eng z ai zh e l u k ou AP SP,0.09 0.2475 0.1725 0.3475 0.2825 0.16 0.27 0.14 0.17 0.16 0.24 0.13 0.23 0.19 0.215 0.25231 0.135397
4_trhxn_19,SP b en x i ang g e z i d e x ing f u h e SP i SP h an zh ong l ao q v AP SP,0.12941 0.05 0.2975 0.39 0.0125 0.0975 0.0625 0.35 0.1 0.14 0.06 0.44 0.17 0.31 0.1 0.33 0.11 0.37 0.07 0.31 0.09 0.04 0.34 0.1 0.34 0.05 0.17 0.15 0.495 0.35287 0.140431
4_slsz_3,SP x vn zh ao sh i l uo d e sh a zh ou SP AP,0.19966 0.18 0.2575 0.0925 0.58 0.5 0.01 0.09 0.59 0.08 0.2 0.19 0.28 0.13 0.82 0.43 0.39981
4_wzqad_11,x ve h u ei l e n i z u ei ai d e k ai l ang SP,0.19 0.0975 0.1425 0.01 0.2075 0.0525 0.25 0.19 0.4 0.14 0.01 0.06 0.64 0.12 0.08 0.2 0.35 0.1 0.815 0.2175
4_jd_46,SP uo h e n i sh ou q i an sh ou,0.07 0.3375 0.1725 0.36 0.17 0.31 0.18 0.3 0.19 0.03 0.27 0.19 0.34575
4_nbzdds_23,SP n i b u zh i d ao d e sh i SP AP SP,0.120249 0.09 0.22 0.13 0.51 0.2 0.26 0.08 0.6 0.09 0.41 0.42 1.435 0.38 0.19 0.047
4_wzqad_33,SP r ang uo q in i q in AP x i ang g uo q v i SP,0.15542 0.14 0.4075 0.3 0.2125 0.24 0.21 0.23 0.36 0.25 0.21 0.01 0.05 0.09 0.46 0.25 0.58 2.5 0.23381
4_htdst_24,SP sh i g uo l e SP AP SP d uo sh ao g e q i ou d ong AP SP,0.445601 0.4675 0.0125 0.1 0.39 0.41 0.81 0.325 0.265 0.09 0.06 0.19 0.19 0.29 0.1 0.21 0.2 0.01 0.24 0.11 1.07 0.36431 0.284853
4_slsz_23,l i ou x ia uo AP SP v h u ei d e SP p SP ai h AP uai,0.2275 0.0125 0.02 0.2 0.3775 0.6575 0.395 0.06 0.57 0.16 0.01 0.63 0.09 0.265 0.045 0.03 0.04 0.63 2.56 0.35 0.05394
4_wzqad_19,r ang uo q in i q in AP x i ang p eng i ou i i ang SP AP SP,0.09 0.4075 0.32 0.2225 0.27 0.2 0.23 0.4 0.24 0.2725 0.0275 0.01 0.08 0.49 0.02 0.61 1.56 0.01 0.395 0.51 0.2295 0.256009
4_sh_4,SP uo m ei i ou sh en m e SP in ing m o zh ang SP AP SP,0.1 0.3775 0.1425 0.52 0.01 0.03 0.23 0.37 0.26 0.37 0.55 0.01 0.15 0.17 0.36 0.14 1.215 0.34 0.21 0.13394
4_syst_11,SP zh eng b u g uo zh ao x i AP SP i ou n i an zh e u ang x i AP,0.16415 0.17 0.14 0.1 0.11 0.13 0.12 0.13 0.34 0.24 0.38 0.24 0.15 0.01 0.02 0.11 0.02 0.12 0.13 0.53 0.01 0.02 0.23 0.36 0.20706
4_nbzdds_43,u ei sh en m e h en x ia x in AP,0.02 0.5975 0.1525 0.1275 0.2125 0.5 0.15 0.51 0.19 0.53 0.17 0.255 0.34775
4_dance_4,n i k e i s u ei zh e uo d e b u f a,0.13 0.25 0.15 0.3275 0.2625 0.2 0.01 0.3 0.06 0.35 0.32 0.11 0.24 0.17 0.23 0.14 0.25625
4_jd_24,SP uo m en d ou l ei l e SP AP,0.742336 0.1975 0.0725 0.16 0.09 0.17 0.11 0.38 0.11 0.625 0.59 0.29331
4_jd_17,SP i ong van d e ai SP uo SP AP SP,0.28 0.01 0.1475 0.49 0.0925 0.39 0.01 0.59 0.88 0.22 0.60525 0.22254
4_ycjh_4,SP x ia i m i ao zh uan sh en j i ou n eng SP h e h ao SP,0.190249 0.21 0.2775 0.2125 0.13 0.02 0.23 0.11 0.2 0.18 0.21 0.34 0.01 0.02 0.13 0.275 0.255 0.17 0.49 0.2 0.845 0.569315
4_hjbj_1,SP z ou g uo n i l ai sh i d e l u SP,0.371474 0.21 0.27 0.14 0.28 0.12 0.29 0.12 0.4 0.25 0.44 0.15 0.32 0.13 1.075 0.40256
4_wzdssl_22,SP sh i n i b i an l e SP,0.347098 0.25 0.2475 0.1025 0.24 0.19 0.01 0.22 0.16 0.8 0.72894
4_jd_21,SP d ang ch u n ei x ie u en r ou SP AP,0.420091 0.15 0.3375 0.1825 0.3175 0.1125 0.3 0.16 0.65 0.01 0.02 0.32 0.655 0.125 0.74675
4_wzdssl_7,SP n i i ao sh uo h ua l e SP AP SP,0.314308 0.12 0.4275 0.0125 0.1975 0.1625 0.2 0.18 0.36 0.06 0.87 0.29 0.32438 0.290068
4_zgz_41,l i an i an l ei d ou j ve d e z i i ou AP SP,0.13 0.01 0.4875 0.0125 0.01 0.3 0.26 0.13 0.27 0.12 0.17 0.1 0.22 0.56 0.01 0.02 0.245 0.31194 0.458707
4_zgz_36,SP uo k e i g en z ai n i sh en h ou AP SP,0.06 0.3575 0.1525 0.3975 0.2725 0.15 0.29 0.13 0.19 0.1 0.22 0.19 0.27 0.13 0.24 0.24012 0.122834
4_trhxn_21,SP g uo d e k uai l e h uo,0.326485 0.08 0.34 0.07 0.25 0.18 0.77 0.08 0.67 0.18 1.6525
4_zgz_13,b u g uan n i h u ei b u h u ei j ing g uo AP,0.14 0.23 0.14 0.21 0.16 0.25 0.17 0.02 0.27 0.12 0.1 0.26 0.01 0.1575 0.1225 0.28 0.09 0.22 0.34725
4_zgz_25,SP in u ei n i i ou m eng k e z uo SP AP,0.14 0.6475 0.0125 0.02 0.17 0.62 0.01 0.06 0.13 0.26 0.17 0.26 0.15 0.905 0.285 0.29319
4_dance_33,SP n i g ei SP d e ai SP AP,0.312154 0.09 0.26 0.11 1.815 0.105 0.04 2.16 0.205 0.3 0.72
4_sh_8,SP uo m ei i ou sh uo h u ang SP AP SP uo h e b i sh uo h u ang SP AP,0.13 0.4075 0.1125 0.65 0.01 0.04 0.25 0.65 0.23 0.01 0.845 0.1 0.355 0.08 0.33 0.15 0.39 0.11 0.26 0.22 0.64 0.24 0.01 0.745 0.16 0.44475
4_zgz_12,SP uo k e i d eng z ai zh e l u k ou AP SP,0.406032 0.2675 0.1425 0.3675 0.2725 0.16 0.32 0.12 0.18 0.15 0.27 0.12 0.24 0.18 0.225 0.22869 0.330295
4_slsz_33,zh i sh i d ang d u z i z ou r u r en h ai SP AP SP,0.2875 0.0325 0.4575 0.06 0.0525 0.3 0.1 0.26 0.12 0.21 0.12 0.33 0.12 0.21 0.11 0.21 0.16 2.075 0.1 0.28106 0.106145
4_dance_27,SP u zh u d e d eng d ai SP AP SP,0.24 0.08 0.11 0.29 0.07 0.26 0.13 2.58 0.07 1.14 0.26 0.575 0.470907
4_ckyg_22,SP uo i u ei d e i u ang SP AP SP,0.405125 0.1275 0.36 0.0125 0.02 0.11 0.1975 0.2825 0.02 1.45 0.245 0.42581 0.18263
4_dance_19,SP in c ang b u zh u d e c u ei r uo SP AP SP,0.304399 0.25 0.15 0.31 0.09 0.23 0.14 0.28 0.07 0.27 0.2 0.01 0.24 0.1 0.62 0.325 0.55919 0.318639
4_wzqad_2,SP j ing g uo n a d uan i h an SP q ing n i f ang x in SP AP SP,0.437823 0.15 0.12 0.09 0.12 0.11 0.18 0.1575 0.3425 0.28 0.22 0.705 0.435 0.17 0.13 0.13 0.42 0.21 1.34 0.19 0.715 0.24 0.395 0.09281
4_hjbj_6,SP zh i sh i m ei l e n i d e h ua m i an SP,0.412902 0.8175 0.0325 0.26 0.18 0.17 1.4 0.1 0.28 0.14 0.27 0.12 0.23 0.18 0.27 0.2 0.01 0.475 0.823247
4_htdst_35,n i d e l ei SP AP,0.12 0.49 0.13 0.42 0.14 3.4 0.24 0.30775
4_yyzbs_12,s i n i an q ve AP b ei d u ei b ei zh ang u ang SP AP,0.15 0.2975 0.0725 0.01 0.22 0.17 0.29 0.3375 0.0825 0.26 0.12 0.01 0.22 0.12 0.38 0.18 0.84 0.01 0.905 0.34 0.27919
4_ycjh_24,SP b u p SP a n i k u SP,0.412653 0.13 0.22 0.03 0.39 0.01 0.4 0.18 0.21 0.53 1.071195
4_wzqad_6,SP uo z u ei q in ai d e SP AP n i g uo d e z en m e i ang AP SP,0.328685 0.3075 0.3 0.0125 0.02 0.25 0.18 0.22 0.08 0.52 0.335 0.2675 0.1175 0.13 0.1 0.12 0.05 0.25 0.19 0.27 0.13 0.23 0.02 2.28 0.31025 0.223991
4_dance_7,t u r an zh i j i an l ang m an SP u f a sh i SP h uai SP AP,0.2 0.29 0.1 0.2775 0.1025 0.26 0.14 0.01 0.31 0.05 0.36 0.07 0.39 0.41 0.51 0.19 0.5875 0.3425 0.435 0.095 0.1 0.545 0.085 0.363
4_yyzbs_9,SP u f a i u ang SP,0.65 0.02 0.22 0.71 0.73 0.02 1.975 0.29581
4_sh_3,c ai h u ei j ie g uo d ou SP zh en u ang SP AP SP,0.18 0.24 0.21 0.01 0.68 0.17 0.32 0.15 0.33 0.15 0.5 0.38 0.13 0.37 0.01 1.475 0.39 0.375 0.42597
4_wzqad_1,h ai b u r u n i SP AP SP d u ei uo j i ang SP,0.15 0.1 0.13 0.14 0.09 0.4 0.15 0.46 0.075 0.14 0.145 0.08 0.01 0.37 0.14 0.27 0.01 0.505 0.35025
4_hjbj_18,SP sh u x i d e n a i t i ao j ie SP,0.360091 0.21 0.23 0.2 0.28 0.11 0.25 0.16 0.57 0.5 0.42 0.01 0.02 0.18 1.13 0.39725
4_ycjh_13,SP n i k e zh i d ao SP uo u ei i d e x i ang i ao SP AP SP,0.117483 0.17 0.19 0.16 0.17 0.21 0.26 0.09 0.34 0.32 0.46 0.01 0.06 0.43 0.1 0.19 0.81 0.01 0.01 0.02 1.08 0.085 0.44425 0.399252
4_dance_11,SP sh i f ou uo i g e r en z ou AP SP,0.49356 0.21 0.2375 0.1225 0.03 0.75 0.29 0.1 0.25 0.14 0.29 0.1 0.365 0.31938 0.46229
4_yhys_25,SP n i i ou k e z eng l ai g uo AP SP uo d e m eng l i SP AP SP,0.201837 0.14 0.5875 0.0125 0.02 0.19 0.99 0.19 0.4 0.08 0.62 0.17 0.265 0.425 0.05 0.36 0.1 0.2 0.19 0.74 0.09 0.82 0.17 0.45788 0.492902
4_nbzdds_2,SP ie k ong s a m an l e x ing x ing SP,0.808844 0.02 0.15 0.15 0.2 0.51 0.19 0.26 0.11 0.78 0.18 0.15 0.21 0.795 0.568611
4_htdst_18,SP uo d e l ang m an SP t ai b u j i g e SP AP SP,0.09 0.15 0.07 0.1 0.11 0.3675 0.1125 0.615 0.275 0.17 0.23 0.14 0.13 0.17 0.15 0.14 0.635 0.35 0.24431 0.263537
4_wzqad_16,SP uo z u ei q in ai d e SP AP n i g uo d e z en m e i ang AP,0.04 0.3475 0.32 0.0125 0.02 0.21 0.17 0.25 0.09 0.635 0.105 0.325 0.105 0.11 0.11 0.13 0.06 0.27 0.18 0.27 0.12 2.48 0.01 0.055 0.28563
4_yyzbs_15,SP z en h u ei sh i q v f ang x i ang SP AP SP,0.124354 0.13 0.19 0.2875 0.0125 0.05 0.19 0.23 0.15 0.23 0.14 0.23 2.87 0.01 0.355 0.615 0.11 0.28369
4_wzdssl_17,SP uo d e x in zh en d e sh ou SP sh ang l e SP AP SP,0.456961 0.3275 0.1125 0.26 0.18 0.25 0.16 0.26 0.13 0.19 0.25 0.41 0.28 0.19 0.7 0.12 0.725 0.405 0.425 0.05819
4_yhys_15,SP zh i d ao uo sh u ei d e SP q ing SP AP SP,0.383787 0.22 0.2875 0.1125 0.24 0.34 0.26 0.01 0.5 0.11 0.62 0.22 0.34 1.225 0.335 0.395 0.19525
4_yj_8,SP uo v j i an sh ei h u ei i ou z en i ang d e d u ei b ai SP AP SP,0.1 0.4275 0.2225 0.11 0.03 0.15 0.18 0.52 0.15 0.01 0.01 0.02 0.5 0.14 0.28 0.02 0.24 0.14 0.18 0.16 0.01 0.5 0.15 0.685 0.08 0.34881 0.422608
4_htdst_26,zh i n eng ch ong b o h SP uai j i ou SP,0.13 0.2975 0.0725 0.23 0.17 0.33 0.04 0.22 0.025 0.065 0.5 0.13 0.04 0.51 0.626511
4_hjbj_22,SP z ai j ie j i ao d e k a f ei d i an SP,0.141769 0.18 0.28 0.14 0.25 0.26 0.01 0.13 0.16 0.38 0.24 0.37 0.23 0.23 0.15 0.07 1.42 0.30656
4_jd_23,SP sh uo SP i ao i q i SP AP z ou d ao SP AP SP z u ei AP h ou SP AP SP,0.343696 0.19 0.405 0.065 0.01 0.01 0.2 0.32 0.74 0.1 0.35 0.13 0.17 0.13 0.965 0.09 0.305 0.06 0.17 0.01 0.4 0.17 0.05 2.31 0.375 0.425 0.06994
4_htdst_13,x in t eng n i sh i k e AP h u ei t ong d e sh i t ou SP AP,0.23 0.7175 0.0925 0.62 0.17 0.61 0.4 0.01 0.11 0.38 0.26 0.14 0.01 0.27 0.09 0.35 0.05 0.59 0.28 0.17 0.09 0.97 0.16 0.21925
4_nbzdds_28,SP uo f ei x ing SP AP SP,0.686077 0.02 0.19 0.47 0.22 0.545 0.12 0.23 0.04481
4_slsz_31,SP b u sh i n i AP x i ang k an j i an d e uo AP SP,0.229274 0.08 0.16 0.2 0.2875 0.1025 0.465 0.205 0.17 0.01 0.86 0.13 0.67 0.32 0.01 0.02 0.12 0.69 2.56 0.34719 0.338209
4_wzqad_25,g uan x in q ve z en m e n eng sh uo d uan AP j i ou d uan SP,0.1 0.29 0.17 0.2575 0.1725 0.25 0.18 0.21 0.17 0.28 0.13 0.21 0.2 0.33 0.17 1.895 0.375 0.43 0.01 0.02 0.13 2.065 0.38387
4_wzdssl_16,r en sh i b u k uai l e SP AP,0.11 0.23 0.19 0.2775 0.1325 0.22 0.2 0.32 0.09 0.8 0.32 0.38406
4_htdst_1,SP uo m en d a x i ao zh e i q i SP h u ei t ou SP,0.530748 0.1375 0.0925 0.1675 0.0825 0.91 0.39 0.01 0.08 0.17 0.3 0.16 0.25 0.485 0.345 0.18 0.02 0.23 0.19 0.615 0.26631
4_jd_42,SP i q i an d e SP i j v h ua,0.09 0.28 0.5575 0.0125 0.02 0.13 0.39 0.11 0.27 0.23 0.27 0.19 0.37575
4_ycjh_21,SP x i ang i ong n i SP AP r u uo h uai b ao SP AP SP,0.1922 0.4675 0.0125 0.01 0.02 0.2775 0.1425 0.5 0.11 0.29 0.13 0.35 0.47 0.2 0.61 0.1 0.83 0.295 0.43275 0.331633
4_nn_13,n i z i j i q ve b u zh i d ao AP,0.08 0.18 0.16 0.1275 0.1225 0.13 0.16 0.17 0.12 0.19 0.11 0.19 0.07 0.61 0.45931
4_dance_36,SP b u van m i an d u ei d e b u d ong SP AP SP,0.322358 0.1 0.28 0.3675 0.1125 0.02 0.3 0.07 0.01 0.32 0.04 0.27 0.13 0.28 0.09 0.775 0.27 0.48919 0.243039
4_zgz_20,SP h ai z i m en u ei n i ch ang g e SP AP SP,0.371497 0.14 0.28 0.16 0.3475 0.0425 0.57 0.01 0.02 0.1 0.38 0.48 0.03 0.11 0.565 0.24 0.33 0.07275
4_zgz_24,d uo m e m i ao x i ao i g e uo SP AP,0.1 0.29 0.11 0.28 0.4 0.01 0.02 0.54 0.01 0.01 0.15 0.13 0.45 0.46 0.075 0.26225
4_yyzbs_19,sh i n i i u f an g u SP,0.09 0.1075 0.0925 0.01 0.95 0.02 0.15 0.31 0.06 0.32306 0.143129
4_nn_51,SP uo ie x i u ang b i an g eng h SP,0.272608 0.4375 0.0125 0.19 0.2375 0.0225 0.18 0.1 0.08 0.4475 0.0725 0.34 0.095 1.7485
4_nn_17,SP d a c ong x in l i n uan n uan d e SP,0.261633 0.1 0.17 0.13 0.14 0.14 0.1575 0.1125 0.17 0.1 0.16 0.13 0.25 0.06 0.22 0.567034
4_htdst_36,SP r ang SP uo t SP,0.11932 0.2 1.395 0.445 2.12 0.09 0.63955
4_yhys_0,SP SP r i ch u i ou r i l uo SP AP sh en ch u z ai sh en ch u SP AP SP,0.371757 0.045 0.12 0.1775 0.2025 0.62 0.01 0.02 0.18 0.24 0.12 1.01 0.23 0.36 0.19 0.26 0.17 0.26 0.15 0.31 0.16 0.23 0.21 0.715 0.345 0.33 0.345307
4_ckyg_7,k e m ei i ou m eng x i ang AP h e b i van f ang SP AP SP,0.16 0.07 0.14 0.5375 0.0125 0.04 0.1 0.47 0.92 0.01 0.145 0.305 0.2 0.32 0.15 0.46 0.3 0.16 2.015 0.225 0.48144 0.189274
4_dance_5,SP q ing q ing r ou r ou d e c ai SP AP,0.463923 0.15 0.22 0.16 0.14 0.19 0.28 0.12 0.61 0.13 0.57 0.21 0.56 0.08 0.43456
4_zgz_19,SP n i sh i x ia ie d e SP ing h uo SP AP SP,0.370181 0.03 0.28 0.3075 0.0425 0.2 0.68 0.02 0.14 0.16 0.11 0.28 0.22 0.4 0.075 0.23619 0.453673
4_ckyg_17,s uo i ou d e m i an m u SP AP SP uo d ou b u k ang j v SP AP,0.18 0.8075 0.0125 0.01 0.07 0.15 0.13 0.01 0.27 0.16 0.72 0.1 0.265 0.065 0.06 0.17 0.39 0.06 0.15 0.14 0.48 0.11 2.04 0.245 0.12456
4_ycjh_27,SP i sh u ang i an j ing zh u ei zh e n i l uan p SP ao AP,0.497188 0.23 0.15 0.01 1.25 0.01 0.02 0.1 0.27 0.11 0.05 0.55 0.1 0.57 0.14 0.49 0.16 0.31 0.28 0.1 0.34 0.3325
4_ckyg_15,z u ei u en r ou d e SP AP SP ve g u ang SP,0.16 0.01 0.3375 0.0125 0.02 0.35 0.76 0.17 0.93 0.355 0.325 0.2 0.32 0.11 0.01 2.235 0.881733
4_dance_34,SP t i an m ei d e sh ang h ai SP AP SP AP,0.394104 0.13 0.02 0.1575 0.2125 0.3 0.06 0.16 0.21 2.59 0.15 1.09 0.29 0.435 0.045 0.1415
4_dance_3,r ang r en SP h ao b u AP SP t eng ai SP AP,0.12 0.55 0.2 0.62 0.04 0.1 0.29 0.14 0.58 0.165 0.385 0.04 0.35 0.675 0.23 0.48413
4_yyzbs_11,SP sh i x i ao zh e v n i f en k ai SP,0.425578 0.2 0.0775 0.2025 0.01 0.2875 0.0625 0.19 0.39 0.11 0.21 0.18 0.26 0.12 0.231 0.411791
4_dance_38,b u zh i d ao m i an q i an d e n i sh i f ou SP i r an SP ai SP,0.13 0.24 0.12 0.3375 0.0525 0.28 0.12 0.01 0.26 0.13 0.01 0.32 0.04 0.28 0.12 0.21 0.23 0.17 0.42 0.03 0.1 0.22 0.13 0.25 0.07 2.2 0.23063
4_ckyg_2,SP uo h u ei i zh i x i ang n i SP AP SP u ang j i l e h u x i SP,0.410975 0.1175 0.1325 0.01 0.1575 0.5525 0.23 0.41 0.42 0.01 0.07 0.15 0.63 0.43 0.27 0.59 0.01 0.02 0.15 0.25 0.16 0.24 0.21 0.14 0.25 0.55 0.7984
4_wzqad_30,SP uo z u ei q in ai d e SP AP n i g uo d e z en m e i ang AP SP,0.231746 0.2975 0.31 0.0125 0.02 0.23 0.15 0.28 0.09 0.54 0.135 0.3175 0.1175 0.13 0.08 0.16 0.05 0.25 0.16 0.31 0.11 0.26 0.02 2.3 0.35025 0.455488
4_yhys_12,SP ve er m ing f eng er q ing AP,0.337302 0.1675 1.2825 0.19 1.39 0.19 1.1 0.27 0.21 0.325 0.35781
4_yyzbs_5,b u i ong k ai SP k ou SP AP SP ie j i ou u x v SP AP SP d uo c ang SP AP SP,0.11 0.5175 0.0125 0.03 0.2 0.55 0.05 0.19 0.655 0.38 0.25 0.135 0.25 0.16 0.03 0.15 0.63 0.31 0.685 0.375 0.195 0.345 0.08 0.22 0.25 1.775 0.23 0.285 0.670213
4_slsz_27,SP h ai i ou sh ei n eng l ai j i ao uo ai SP AP SP,0.291633 0.13 0.5375 0.0125 0.04 0.19 0.24 0.13 0.25 0.12 0.23 0.37 0.01 0.01 0.7225 1.8575 0.425 0.39069 0.158299
4_jd_8,SP uo m en d ou u ang l e SP AP SP,0.18 0.2075 0.0825 0.16 0.09 0.43 0.01 0.02 0.32 0.64 0.49 0.28 0.08538
4_trhxn_12,SP uo m en x i ang i sh ou z u ei m ei l i d e g e q v SP AP SP,0.1 0.3375 0.1425 0.61 0.61 0.01 0.01 0.13 0.13 0.1 0.35 0.01 0.02 0.16 0.14 0.07 0.11 0.11 0.26 0.16 0.25 0.23 0.65 0.405 0.205 0.1235
4_nbzdds_40,SP s u ei l uo m an d e SP AP,0.110998 0.8175 0.0125 0.02 0.12 0.12 0.17 0.6 0.06 0.455 0.105 0.28319
4_trhxn_7,SP zh i sh eng i an l ei SP AP h ai SP p i an b u g uo z i j i SP AP,0.204036 0.11 0.24 0.18 0.55 0.01 0.02 0.28 0.735 0.245 0.34 0.13 0.125 0.065 0.34 0.01 0.02 0.14 0.23 0.16 0.27 0.16 0.27 0.15 1.46 0.285 0.60356
4_ckyg_5,SP s uo i ou d e m i an m u SP AP SP uo SP d ou b u k ang j v SP AP SP,0.243379 0.2 0.7675 0.0125 0.02 0.07 0.13 0.14 0.02 0.28 0.12 0.72 0.1 0.25 0.1 0.12 0.05 0.08 0.33 0.1 0.14 0.17 0.45 0.12 1.585 0.425 0.35 0.513657
4_jd_35,SP k an j i an l e AP b u t ong d e t i an k ong AP SP,0.243787 0.16 0.14 0.12 0.03 0.1675 0.2825 0.64 0.5 0.09 0.13 0.11 0.16 0.09 0.31 0.19 0.02 0.33 0.15 0.475 0.36325 0.146417
4_nbzdds_7,SP h ai t ing j i an h u x i SP AP SP,0.252132 0.11 0.18 0.15 0.21 0.13 0.05 0.47 0.18 0.21 0.23 0.605 0.335 0.345 0.25481
4_dance_20,SP f an l an h e sh u ei j i ang uo ch ong x i ang n i d e x in t ou AP,0.126939 0.17 0.3175 0.0525 0.2475 0.1225 0.27 0.14 0.01 0.23 0.68 0.01 0.01 0.0575 0.1625 0.25 0.2 0.01 0.16 0.15 0.24 0.07 0.26 0.18 0.25 0.14 0.325 0.37019
4_jd_22,SP uo h e n i sh ou q i an sh ou SP,0.179909 0.3675 0.2025 0.33 0.16 0.31 0.19 0.31 0.22 0.04 0.26 0.18 0.33219 0.272154
4_wzqad_15,ai g uo n i j i ou b u SP p a g u d an SP,0.4675 0.0725 0.3475 0.1125 0.24 0.18 0.03 0.23 0.15 0.23 0.13 0.29 0.01 0.17 0.18 0.12 1.245 0.677927
4_nn_2,x i ao h uo ch e SP AP SP b ai d ong d e x van l v SP,0.17 0.01 0.1475 0.1325 0.13 0.19 0.37 0.125 0.17 0.085 0.08 0.19 0.12 0.46 0.07 0.14 0.17 0.25 0.05 0.835 0.557863
4_syst_42,b ie g uai uo t an x in AP zh i sh i b u van x ing AP,0.15 0.11 0.13 0.2175 0.1225 0.18 0.27 0.22 0.415 0.225 0.12 0.07 0.26 0.02 0.12 0.2 0.34 0.23 0.395 0.2685
4_nbzdds_29,SP d ang n i zh u ei l uo zh i j i SP AP SP,0.36424 0.08 0.19 0.15 0.2 0.74 0.01 0.02 0.1 0.26 0.16 0.54 0.15 0.51 0.08 0.26981 0.202789
4_ycjh_23,SP x ia i m i ao zh uan sh en j i ou n eng h e h ao SP AP SP,0.133333 0.15 0.3575 0.2025 0.13 0.02 0.27 0.08 0.21 0.15 0.25 0.32 0.01 0.02 0.13 0.55 0.16 0.53 0.15 1.0 0.24 0.45 0.442208
4_nn_36,d a c ong x in l i n uan n uan d e AP,0.08 0.17 0.13 0.14 0.16 0.1375 0.1125 0.16 0.11 0.14 0.13 0.26 0.05 0.24 0.27881
4_nn_15,SP b u i ao q i ou h u ei b ao AP SP,0.300204 0.12 0.6275 0.0125 0.05 0.25 0.01 0.05 0.5 0.01 0.02 0.14 0.225 0.307 0.240794
4_wzdssl_25,SP in ve j ing zh i l e SP AP,0.12 0.3475 0.3025 0.16 0.27 0.13 0.31 0.08 0.615 0.29 0.46331
4_zgz_6,n i sh i i ao van d e x ing h e SP AP,0.1 0.28 0.4675 0.0125 0.01 0.01 0.87 0.06 0.11 0.2 0.29 0.22 0.4 0.07 0.24369
4_wzqad_5,SP ai g uo n i j i ou b u SP p a g u d an SP AP SP,0.241565 0.4775 0.0925 0.3375 0.1225 0.23 0.2 0.03 0.21 0.15 0.23 0.12 0.28 0.01 0.17 0.17 0.15 0.825 0.235 0.405 0.273671
4_syst_43,SP in u ei n i zh i u ei n i van h e uo i q i AP,0.09 0.3575 0.0125 0.02 0.12 0.3 0.19 0.37 0.01 0.02 0.11 0.39 0.22 0.13 0.16 0.3 0.28 0.24 0.19 0.22844
4_nn_18,n i b i z i j i g eng zh ong i ao SP AP SP,0.11 0.16 0.13 0.12 0.2 0.0775 0.1725 0.13 0.13 0.46 0.12 0.48 0.01 1.44 0.61 0.294 0.309184
4_yyzbs_1,SP zh ao b u l i ang n i SP g uo u ang SP,0.489773 0.15 0.21 0.1 0.25 0.33 0.01 0.01 0.11 0.85 0.41 0.1 0.61 0.01 0.53 0.621278
4_jd_16,sh ei h ai j i d e sh i sh ei x i an sh uo AP SP,0.28 0.35 0.17 0.32 0.16 0.43 0.07 0.11 0.3 0.26 0.19 0.33 0.5 0.01 0.04 0.22 0.47 0.34112 0.314535
4_jd_3,sh i uo m en SP AP SP i h ou d e sh ang k ou SP AP SP,0.2 0.1675 0.1825 0.15 0.865 0.115 0.465 0.085 0.12 0.13 0.13 0.13 0.34 0.18 0.38 0.19 0.42 0.08 0.36044 0.396712
4_htdst_8,SP zh i n eng ch ong b o h SP uai j i ou SP,0.199955 0.14 0.2675 0.0925 0.23 0.16 0.3 0.09 0.2 0.02 0.06 0.38 0.13 0.03 0.555 0.36363
4_hjbj_0,SP SP uo l ai d ao SP n i d e ch eng sh i SP,0.57 0.0675 0.9025 0.19 0.32 0.11 0.89 0.44 0.13 0.39 0.11 0.28 0.19 0.23 0.66 0.34 0.26369
4_ckyg_19,k e m ei i ou m eng x i ang SP AP h e b i van f ang SP AP SP,0.15 0.07 0.14 0.5475 0.0125 0.02 0.15 0.47 0.88 0.01 0.115 0.085 0.27 0.21 0.28 0.16 0.47 0.35 0.15 2.365 0.095 0.40719 0.448413
4_htdst_34,SP j ve j i ang d e b i ao q ing l i SP AP sh an g uo l e SP sh i l uo SP,0.309252 0.16 0.27 0.13 0.01 0.3275 0.0525 0.71 0.08 0.01 0.2275 0.1525 0.3 0.11 0.605 0.095 0.25 0.17 0.34 0.04 0.27 0.12 0.505 0.095 0.44 0.01 0.14 0.39 0.403612
4_ckyg_20,SP uo SP i zh i d ou z ai l i ou l ang SP,0.07 0.125 0.155 0.3 0.16 0.33 0.14 0.34 0.13 0.19 0.57 0.01 0.05 0.1 0.34863 0.439206
4_ycjh_12,SP z ai z i i ou z i z ai d e k ong q i l i ch ao ch ao n ao n ao AP SP,0.368685 0.13 0.22 0.15 0.3175 0.0125 0.25 0.14 0.21 0.12 0.27 0.08 0.18 0.19 0.19 0.19 0.21 0.09 0.18 0.19 0.19 0.15 0.22 0.11 0.23 0.11 0.5 0.41775 0.333039
4_wzqad_12,x i ang q i n i d e m u i ang SP i ou sh en m e c uo SP AP SP,0.2775 0.0125 0.05 0.16 0.07 0.11 0.14 0.12 0.16 0.19 0.36 0.02 0.865 0.435 0.02 0.12 0.16 0.26 0.3 1.33 0.23 0.735 0.32 0.21919 0.135556
4_sh_21,d an uo j ing r an i ou x ie b u AP x i g uan SP AP SP,0.09 0.4275 0.36 0.1525 0.36 0.1 0.22 0.01 0.53 0.19 0.34 0.14 0.44 0.34 0.2 0.3 0.14 1.47 0.305 0.40981 0.204308
4_yj_2,SP uo x i ang uo d eng uo q i d ai SP,0.465601 0.1475 1.0625 0.01 0.01 0.24 0.14 1.11 0.05 0.24 0.44 0.13 0.665 0.42481
4_sh_22,SP uo m ei i ou sh uo h u ang SP AP SP uo h e b i sh uo h u ang SP AP SP,0.06 0.4275 0.1025 0.67 0.01 0.06 0.24 0.62 0.24 0.02 0.7 0.17 0.435 0.115 0.32 0.18 0.37 0.11 0.26 0.24 0.6 0.25 0.01 0.71 0.17 0.47975 0.386168
4_ckyg_13,SP j i m o AP zh u ch eng i d ao u ei q i ang SP,0.257551 0.1 0.16 0.1 0.21 0.32 0.1 0.31 0.19 0.38 0.2 0.13 0.77 0.01 0.03 0.15 0.01 0.175 0.372044
4_syst_44,k an vn d an f eng q SP,0.21 0.6375 0.0325 0.09 0.2 0.26 0.33 1.225 0.14975
4_nn_27,SP sh en m e k u en n an d ou j ve d e i ou x i u ang SP AP SP,0.28195 0.16 0.1 0.16 0.16 0.2075 0.0225 0.4 0.07 0.45 0.11 0.2 0.13 0.03 0.06 0.27 0.01 0.02 0.17 0.23 0.01 1.05 0.085 0.255 0.05181
4_nbzdds_5,SP d ang n i zh u ei l uo zh i j i SP AP SP,0.155397 0.13 0.2 0.15 0.18 0.16 0.04 0.58 0.06 0.27 0.17 0.49 0.17 0.53 0.075 0.278 0.422698
4_htdst_4,x i ang q i l ai SP AP SP z en m e x i ang m eng SP AP SP,0.4075 0.0125 0.05 0.18 0.2075 0.1525 0.67 0.395 0.175 0.12 0.12 0.19 0.2 0.2 0.2 0.01 0.49 0.05 0.835 0.38 0.235 0.388549
